{
  "requestId": "forecastrequest-004",
  "requestedAt": "2026-06-02T09:55:00Z",
  "requesterId": "agent-fixture",
  "domain": "weather-logistics",
  "geography": "Krakow",
  "serviceDate": "2026-06-03",
  "questionText": "Will heavy rain disrupt last-mile delivery operations in Krakow on 2026-06-03?",
  "outputType": "binary",
  "horizonLabel": "1-day",
  "requestedAction": "validate_only",
  "dataMode": "provided",
  "sourcePolicy": {
    "sourcePolicyId": "sourcepolicy-001",
    "allowedSourceClasses": ["internal_dataset", "public_dataset"],
    "allowedConnectors": ["committed_fixture"],
    "allowNetworkAccess": false,
    "maxNetworkCalls": 0,
    "maxCostUsd": 0,
    "freshness": {
      "maxSourceAgeHours": 72,
      "requireRetrievedAt": true
    },
    "approvalRequired": false,
    "retention": {
      "rawSourceRetention": "fixture_only",
      "storeContentHashes": true
    }
  },
  "riskReview": {
    "highImpact": false,
    "paid": false,
    "external": false,
    "privacySensitive": false
  },
  "approval": {
    "status": "not_required"
  },
  "controls": {
    "maxCostUsd": 0,
    "timeoutSeconds": 60,
    "cancelRequested": false
  }
}
